[{"runId":"process-autonomy-260","id":"6e1a1bae-a49d-4114-aa75-3fb0e2c91cfa","previousDigest":null,"generation":0,"kind":"started","payload":{"goalRef":"issue:260","owner":"codex","profile":"standard","boundary":"external-action","writer":{"host":"skynet-sam01","pid":37148,"instance":"ade4df81-f7f3-485a-9900-01c3ffe613c7"},"budget":null},"timestamp":"2026-09-25T18:21:19.346Z","version":1,"type":"run-event","digest":"33b15413b6013a127db987fe9ff583234598ce57e19d6c7e3c9332e1ca4ab57d"},{"runId":"process-autonomy-260","id":"25594f11-55b6-428e-b2da-832406e41d8f","previousDigest":"33b15413b6013a127db987fe9ff583234598ce57e19d6c7e3c9332e1ca4ab57d","generation":0,"kind":"checkpoint","payload":{"reason":"S0 review returned in issue 261; Agy same-session rework active. Full backlog 261-271 recorded. Meshloop and adoption discovery reports committed at cd3e577. Formal phase remains product-manager pending frozen contract; no acceptance or phase advancement claimed."},"timestamp":"2026-09-25T18:35:58.949Z","version":1,"type":"run-event","digest":"ad3077835d9c2b95c06ada0717af4d23cd83bdae0843a20aa0bfad3b30595f44"}]