[{"runId":"onboarding-251","id":"bd97b343-dda0-40f2-9bda-4b09b970f33e","previousDigest":null,"generation":0,"kind":"started","payload":{"goalRef":"issue:251","owner":"codex-orchestrator","profile":"high-assurance","boundary":"external-action","writer":{"host":"skynet-sam01","pid":7648,"instance":"10427716-af0d-43d2-9026-1d0f2bcec735"},"budget":null},"timestamp":"2026-09-25T15:50:16.309Z","version":1,"type":"run-event","digest":"d15225c70689f59c15e310d77063dbbf4dae54d6b9612fada37923cc4c5e9fa5"},{"runId":"onboarding-251","id":"f7b17236-ef15-4602-a033-9e33fbb43252","previousDigest":"d15225c70689f59c15e310d77063dbbf4dae54d6b9612fada37923cc4c5e9fa5","generation":0,"kind":"contract-frozen","payload":{"contract":{"version":2,"goalRevision":"ee092cf516d99a78e4453ac21cf4d910bb78b36951100e6992735dfab199af85","ownerRole":"product-manager","criteria":[{"id":"documentation-integrity","definitionDigest":"79ef1bb88bc493ade802451eac036e7449f94cfd300f8a1d87282bafdea17c88","assertions":["documentation validation passes"],"allowedOrigins":["collector-observed"],"requireImmutable":false,"maxAgeMs":3600000}]},"sourceRevision":"4c11bb6f1e7251137a82daa6cb72e60513d2789c47ff055c3ab65299a8be97a0"},"timestamp":"2026-09-25T15:55:27.287Z","version":1,"type":"run-event","digest":"9270c68eae654c0d2cb8b753acc8028b1d9dea0a26e9b228447c09666e134433"},{"runId":"onboarding-251","id":"a484cc80-8b29-4c94-b4ce-aba6ea575db8","previousDigest":"9270c68eae654c0d2cb8b753acc8028b1d9dea0a26e9b228447c09666e134433","generation":0,"kind":"candidate","payload":{"digest":"4f70e8cf6b5079672d27e807f79978e7af555fc3d464b4a194d4a59b24c129f2"},"timestamp":"2026-09-25T15:55:40.612Z","version":1,"type":"run-event","digest":"aa5b8ec3ba6acf7ed568b92c64ef02c57cb8b5cd76aa38951fbe6fff8d64b42f"},{"runId":"onboarding-251","id":"ef770042-0f97-4212-a3a0-4399318995be","previousDigest":"aa5b8ec3ba6acf7ed568b92c64ef02c57cb8b5cd76aa38951fbe6fff8d64b42f","generation":0,"kind":"observation","payload":{"observation":{"id":"a182a7fa-7199-4be8-864d-078469d6a4a2","invocationId":"a182a7fa-7199-4be8-864d-078469d6a4a2","criterionId":"documentation-integrity","producer":"agentflow:process-collector","origin":"collector-observed","isolation":"cooperative","candidateDigest":"4f70e8cf6b5079672d27e807f79978e7af555fc3d464b4a194d4a59b24c129f2","definitionDigest":"79ef1bb88bc493ade802451eac036e7449f94cfd300f8a1d87282bafdea17c88","executionContextDigest":"733d2daeedc59383978fc14aad1410b6cf8d7c29f037bcb80b730d8af3f8234f","executionContext":{"platform":"win32","architecture":"x64","collectorRuntime":"v26.10.0","executablePathDigest":"d28bfb0897cf8112493cd75eba61eaa8179b8edd2d8258d556ddcba703984be5","canonicalPathDigest":"d28bfb0897cf8112493cd75eba61eaa8179b8edd2d8258d556ddcba703984be5","executableContentDigest":"cea6ac365f9bb9586dafd2084d996e092e7d3e7d07ab52d1f76bf53d1fca9bc4","version":1,"type":"execution-context","digest":"733d2daeedc59383978fc14aad1410b6cf8d7c29f037bcb80b730d8af3f8234f"},"outcome":"pass","assertions":[{"id":"documentation validation passes","outcome":"pass"}],"startedAt":"2026-09-25T15:55:38.908Z","completedAt":"2026-09-25T15:55:39.058Z","errors":[],"exitCode":0,"signal":null,"timedOut":false,"spawnErrorCode":null,"stderrExcerpt":"","version":1,"type":"verification-observation","digest":"75cabdffb02528d54242308db1799c6b8329b7cafaa7dc3b53cf6a79429e0d6b"}},"timestamp":"2026-09-25T15:55:50.223Z","version":1,"type":"run-event","digest":"bd208cd0cc1e3fee21d14ab3271fae2936bcd2796f4694f184de0edfdd5e9448"},{"runId":"onboarding-251","id":"ae31ca93-493b-4b64-94e2-57deb2d7bcd7","previousDigest":"bd208cd0cc1e3fee21d14ab3271fae2936bcd2796f4694f184de0edfdd5e9448","generation":0,"kind":"paused","payload":{"reason":"Phase 0 returned twice by Codex: invalid ArtifactRef vocabulary and delegated boundary. Resolve the recorded gate before redispatch; no implementation or phase advancement."},"timestamp":"2026-09-25T15:58:24.657Z","version":1,"type":"run-event","digest":"f93753e0dfa1a7897d835d532e0418d1219b348d4cdd24deff518f5d96cd39a7"}]