[{"runId":"qualification301-contention-1790607149383","id":"started","previousDigest":null,"generation":0,"kind":"started","payload":{"owner":"qualification-writer","goalRef":"issue:301","profile":"standard","boundary":"external-action"},"timestamp":"2026-09-28T14:52:29.464Z","version":1,"type":"run-event","digest":"b9417c7223c946c06036c9e8f4e8e1cd821acd90073829b0e7174f8af435111e"},{"runId":"qualification301-contention-1790607149383","id":"resume-a","previousDigest":"b9417c7223c946c06036c9e8f4e8e1cd821acd90073829b0e7174f8af435111e","generation":0,"kind":"resumed","payload":{"previousOwnerStopped":true,"owner":"recovery-a","boundary":"external-action"},"timestamp":"2026-09-28T14:52:44.209Z","version":1,"type":"run-event","digest":"91f64a7e0c58d7f47ba7b5d2e82d448afa53a05a5d572e3677473798c8930885"}]