[{"runId":"qualification-20260928-1790581983874","id":"c7e11af0-43ce-48cf-bd6b-e8ed34829471","previousDigest":null,"generation":0,"kind":"started","payload":{"goalRef":"issue:301","owner":"qualification","profile":"standard","boundary":"external-action","writer":{"host":"skynet-sam01","pid":4496,"instance":"580daf8e-d369-4291-a734-574117a35c83"},"budget":null,"delegationPolicy":{"version":1,"issuers":[{"id":"local","mode":"local-cooperative","origin":"cli","authorityRef":"user:authorized-workstream","allowedActions":["pr:create"],"allowThroughMerge":false}],"requiredChecks":["tests"],"reviewPolicy":"automated","materiality":"fixed-scope-v1","allowSubdelegation":false,"safetyReserve":4}},"timestamp":"2026-09-28T07:53:06.827Z","version":1,"type":"run-event","digest":"5d7d4f4a8cc1695e45616c5158157ae96a8f762e0f0239a60dca1b3a18db9834"}]