[{"runId":"qualification301-public-1790607481439","id":"8ae5c6b5-1777-442b-bc8a-e607e32afa8b","previousDigest":null,"generation":0,"kind":"started","payload":{"goalRef":"issue:301","owner":"codex-301-qualification","profile":"standard","boundary":"external-action","writer":{"host":"skynet-sam01","pid":51524,"instance":"a2758790-dfb2-4636-9ffe-09d2d2208615"},"budget":null,"authorityProtocol":"host-intent-v1","delegationPolicy":{"version":1,"issuers":[{"id":"local","mode":"local-cooperative","origin":"cli","authorityRef":"authorized-agentflow-301-disposable-qualification","allowedActions":["pr:create","pr:update","merge"],"allowThroughMerge":true}],"requiredChecks":["candidate-check"],"reviewPolicy":"automated","materiality":"fixed-scope-v1","allowSubdelegation":false,"safetyReserve":8}},"timestamp":"2026-09-28T15:11:57.332Z","version":1,"type":"run-event","digest":"21f02c18f192ea04f0b53d672223068ea46de4d6282ec4b01f2d39141237225b"},{"runId":"qualification301-public-1790607481439","id":"a558f8a9-2912-460c-b4b6-aed74a02857a","previousDigest":"21f02c18f192ea04f0b53d672223068ea46de4d6282ec4b01f2d39141237225b","generation":0,"kind":"contract-frozen","payload":{"contract":{"version":2,"goalRevision":"176fa01ac599915576043b45fdb19d158c03f185ae9eb5de9f560baa2b764fea","ownerRole":"agentflow:product-manager","collaborationContractDigest":"b1aac4910b24ec931d33fef70e742ade38858fc05e6a2389ee9b824d0c27c4ef","criteria":[{"id":"candidate-check","definitionDigest":"457949cd9b7e5b313873431396540a5f5ed92213f8bfc56df044dc6705a4fe8b","assertions":["Disposable candidate has exactly the approved qualification text"]},{"id":"candidate-review","definitionDigest":"c56373fe77fd5fd87e3644f4695c818d07a98fd20966707201945f76262267d5","assertions":["Disposable candidate has exactly the approved qualification text"]}]},"sourceRevision":"c64e7587d76206424d135167d1bc60827dbb217871b0a8030aafd2b65872a816"},"timestamp":"2026-09-28T15:12:25.842Z","version":1,"type":"run-event","digest":"4c9af0e7db2a919536a3d4f7d33e7cf771d5e9c92d8a84c60837b2cae9b65c8d"},{"runId":"qualification301-public-1790607481439","id":"0eb961f1-09be-4b59-a043-f9415816fc53","previousDigest":"4c9af0e7db2a919536a3d4f7d33e7cf771d5e9c92d8a84c60837b2cae9b65c8d","generation":0,"kind":"candidate","payload":{"digest":"58b4bc88e67ed6821ea8d84e0577170de6174ea2bd5793c997444c133663d5f6"},"timestamp":"2026-09-28T15:12:47.010Z","version":1,"type":"run-event","digest":"bc9bb5f91f863194caf7f06ecf461d231211b1bd8e4e11bd885d2066a5b8d850"},{"runId":"qualification301-public-1790607481439","id":"f5496f8b-110d-44b6-b999-7e3a99efd23a","previousDigest":"bc9bb5f91f863194caf7f06ecf461d231211b1bd8e4e11bd885d2066a5b8d850","generation":0,"kind":"observation","payload":{"observation":{"id":"abd456b8-60b6-4db2-993b-2ea4ab1192c4","invocationId":"abd456b8-60b6-4db2-993b-2ea4ab1192c4","criterionId":"candidate-check","producer":"agentflow:process-collector","origin":"collector-observed","isolation":"cooperative","candidateDigest":"58b4bc88e67ed6821ea8d84e0577170de6174ea2bd5793c997444c133663d5f6","definitionDigest":"457949cd9b7e5b313873431396540a5f5ed92213f8bfc56df044dc6705a4fe8b","executionContextDigest":"733d2daeedc59383978fc14aad1410b6cf8d7c29f037bcb80b730d8af3f8234f","executionContext":{"platform":"win32","architecture":"x64","collectorRuntime":"v26.10.0","executablePathDigest":"d28bfb0897cf8112493cd75eba61eaa8179b8edd2d8258d556ddcba703984be5","canonicalPathDigest":"d28bfb0897cf8112493cd75eba61eaa8179b8edd2d8258d556ddcba703984be5","executableContentDigest":"cea6ac365f9bb9586dafd2084d996e092e7d3e7d07ab52d1f76bf53d1fca9bc4","version":1,"type":"execution-context","digest":"733d2daeedc59383978fc14aad1410b6cf8d7c29f037bcb80b730d8af3f8234f"},"outcome":"pass","assertions":[{"id":"Disposable candidate has exactly the approved qualification text","outcome":"pass"}],"startedAt":"2026-09-28T15:12:45.585Z","completedAt":"2026-09-28T15:12:45.765Z","errors":[],"exitCode":0,"signal":null,"timedOut":false,"spawnErrorCode":null,"stderrExcerpt":"","version":1,"type":"verification-observation","digest":"1121a3d496f68fdf35fe8c91151dda64930cda609d0fc9901dda16a3b9647b14"}},"timestamp":"2026-09-28T15:13:06.573Z","version":1,"type":"run-event","digest":"1850efd89387dc8227ca9363208d683e47e7a8c844d57e56f630ddd05590a758"},{"runId":"qualification301-public-1790607481439","id":"d9e0443e-c38e-4c9e-ae73-771665fd8bbd","previousDigest":"1850efd89387dc8227ca9363208d683e47e7a8c844d57e56f630ddd05590a758","generation":0,"kind":"observation","payload":{"observation":{"id":"70351c58-6682-4a66-9c70-44e6a9d323ff","invocationId":"70351c58-6682-4a66-9c70-44e6a9d323ff","criterionId":"candidate-review","producer":"agentflow:process-collector","origin":"collector-observed","isolation":"cooperative","candidateDigest":"58b4bc88e67ed6821ea8d84e0577170de6174ea2bd5793c997444c133663d5f6","definitionDigest":"c56373fe77fd5fd87e3644f4695c818d07a98fd20966707201945f76262267d5","executionContextDigest":"733d2daeedc59383978fc14aad1410b6cf8d7c29f037bcb80b730d8af3f8234f","executionContext":{"platform":"win32","architecture":"x64","collectorRuntime":"v26.10.0","executablePathDigest":"d28bfb0897cf8112493cd75eba61eaa8179b8edd2d8258d556ddcba703984be5","canonicalPathDigest":"d28bfb0897cf8112493cd75eba61eaa8179b8edd2d8258d556ddcba703984be5","executableContentDigest":"cea6ac365f9bb9586dafd2084d996e092e7d3e7d07ab52d1f76bf53d1fca9bc4","version":1,"type":"execution-context","digest":"733d2daeedc59383978fc14aad1410b6cf8d7c29f037bcb80b730d8af3f8234f"},"outcome":"pass","assertions":[{"id":"Disposable candidate has exactly the approved qualification text","outcome":"pass"}],"startedAt":"2026-09-28T15:13:27.199Z","completedAt":"2026-09-28T15:13:27.372Z","errors":[],"exitCode":0,"signal":null,"timedOut":false,"spawnErrorCode":null,"stderrExcerpt":"","version":1,"type":"verification-observation","digest":"20a20c91cd74c53ac065d97180923032dc754941695ab74e3de409a3cd5d93c6"}},"timestamp":"2026-09-28T15:13:28.605Z","version":1,"type":"run-event","digest":"3803d8435d8cdbbe5e7e6b1b73febaca0b095a730cf3904e9b78cd0af14a4ebd"},{"runId":"qualification301-public-1790607481439","id":"5c3513c7-5250-4013-bb7f-f5ce3672361a","previousDigest":"3803d8435d8cdbbe5e7e6b1b73febaca0b095a730cf3904e9b78cd0af14a4ebd","generation":0,"kind":"advanced","payload":{"from":0,"to":1,"candidateDigest":"58b4bc88e67ed6821ea8d84e0577170de6174ea2bd5793c997444c133663d5f6","acceptanceDigest":"99a3449efea9dd910f2fff54832878534c16a5d02b796efe92b49f04ae295c60","planDigest":"12a44d3f41c9c6b7ee9f1d3995d389c8bb45f673ebfdd3cf8d6ef84a320f1a80","intentRequest":{"gateClass":"adequacy-of-intent","runId":"qualification301-public-1790607481439","runRevision":"3803d8435d8cdbbe5e7e6b1b73febaca0b095a730cf3904e9b78cd0af14a4ebd","generation":0,"goalRef":"issue:301","goalRevision":"176fa01ac599915576043b45fdb19d158c03f185ae9eb5de9f560baa2b764fea","contractSourceRevision":"c64e7587d76206424d135167d1bc60827dbb217871b0a8030aafd2b65872a816","contractDigest":"d8be6483437cbcee71c7c430355047c3597ed5f8948e03631a95caa5bf665914","planDigest":"12a44d3f41c9c6b7ee9f1d3995d389c8bb45f673ebfdd3cf8d6ef84a320f1a80","profile":"standard","observerRuntimes":["agy","antigravity","chatgpt","claude","codex","cowork","grok","pi"],"scope":{"repository":"smota/agentflow-sdlc","coordinationBranch":"agentflow-301-qualification","businessBoundary":"external-action","destinations":["ready-pr","named-merge"],"checks":[{"name":"candidate-check","digest":"da0ab046ad5cb069eed805d7a8696936429fe16fea46646877045d26ab3c9e8f"},{"name":"candidate-review","digest":"236b89a3145843fcfc0f5416061885089ba0dd4b3f609a5f7f3458c7f6ab3351"}],"expiry":{"effectGrant":"separate-typed-grant-required"},"budget":null,"assurance":"agent-observed-local-cooperative"},"version":1,"type":"intent-consent-request","digest":"aeb46d73e2272c9a4633ef0527eecc337adcbb338f2de2011cfcb8aa44a389d3"},"intentConsent":{"requestDigest":"aeb46d73e2272c9a4633ef0527eecc337adcbb338f2de2011cfcb8aa44a389d3","gateClass":"adequacy-of-intent","runId":"qualification301-public-1790607481439","decision":"agree","assurance":"agent-observed-local-cooperative","observerRuntime":"codex","sessionDigest":"c77c6f5211a2fcffafe982959360ebf5fd1d24663a85b5ec3589e9ec58235bf5","turnDigest":"d3a189505b47c6bfabbedefa4e5d61e32800a4e645adbb38822081250f760c25","evidenceDigest":"12e4f57cff9b9ead11332b3021619afb591df65e61e5e8257c9234b8f856d62c","decisionRef":"f6830ace467452d508389e32ba05f332083dc50304a74653a65be4eab87da986","observedAt":"2026-09-28T15:14:45.726Z","expiresAt":"2026-09-28T16:14:45.727Z","version":1,"type":"host-intent-consent","digest":"b1268eb98ebd381c6c56a894ba79cf92d5d1b1334d3673ba3637897eb09150e7"}},"timestamp":"2026-09-28T15:14:55.224Z","version":1,"type":"run-event","digest":"1e54d21b63b76a7587ea248aaec878edb8f3d0daffffe9bc0f1321bb868c32da"},{"runId":"qualification301-public-1790607481439","id":"7c45bf60-48f0-4e66-b6ce-6a2a0bae7d05","previousDigest":"1e54d21b63b76a7587ea248aaec878edb8f3d0daffffe9bc0f1321bb868c32da","generation":0,"kind":"checkpoint","payload":{"reason":"Qualification crash after real source ref update"},"timestamp":"2026-09-28T15:15:54.775Z","version":1,"type":"run-event","digest":"32974269c7c6d8115c1eb807c067b249950b548229b2f34396d724d9043b0cab"}]