[{"runId":"qualification301-source-1790605477152","id":"started","previousDigest":null,"generation":0,"kind":"started","payload":{"owner":"qualification-writer","goalRef":"issue:301","profile":"standard","boundary":"external-action"},"timestamp":"2026-09-28T14:24:37.215Z","version":1,"type":"run-event","digest":"74068ce685280292304a0363e3b417222a0bfac4fe0016f194b45ce4f7955274"}]