[{"runId":"cold304","id":"d848ec22-fc60-477d-8a8a-64e986f5e34b","previousDigest":null,"generation":0,"kind":"started","payload":{"goalRef":"issue:304","owner":"cold-adopter-304","profile":"standard","boundary":"open-pr","writer":{"host":"skynet-sam01","pid":7744,"instance":"9527c533-699a-427a-8bb3-05a56eab924b"},"budget":null,"authorityProtocol":"host-intent-v1"},"timestamp":"2026-09-30T18:25:18.357Z","version":1,"type":"run-event","digest":"abf5ee594ce93fc840cb4229996db257b3e221e227352ff8ca3babe65eed3242"}]