[{"runId":"optional304-1790792362981","id":"9fb27561-0347-465d-82c7-9bb933d3a12f","previousDigest":null,"generation":0,"kind":"started","payload":{"goalRef":"issue:304","owner":"qualifier","profile":"standard","boundary":"open-pr","writer":{"host":"skynet-sam01","pid":15768,"instance":"cd5b21a7-0e95-4a90-b3a7-49899ce6eefd"},"budget":null,"authorityProtocol":"host-intent-v1","delegationPolicy":{"version":1,"issuers":[{"id":"local","origin":"cli","authorityRef":"qualification304","mode":"local-cooperative","allowedActions":["edit"],"allowThroughMerge":false}],"requiredChecks":["starter"],"reviewPolicy":"automated","materiality":"fixed-scope-v1","allowSubdelegation":false,"safetyReserve":4}},"timestamp":"2026-09-30T18:19:27.965Z","version":1,"type":"run-event","digest":"f8e9d9d718a97255bcc9900a2710f90f9a103b0d9cd3f7b6c78b54f1ac7c3c4c"},{"runId":"optional304-1790792362981","id":"ee8695a4-cafa-485f-9cec-1ee48da52a51","previousDigest":"f8e9d9d718a97255bcc9900a2710f90f9a103b0d9cd3f7b6c78b54f1ac7c3c4c","generation":0,"kind":"contract-frozen","payload":{"contract":{"version":2,"goalRevision":"4d5e3315e619764fd6e190122a974bdcb477447a8bc2078ef349143ab567ec9f","criteria":[{"id":"starter","definitionDigest":"11629e1405b3f4c5fe2503a94aa9d941937026c4f973523f8e753d408fc29c74","assertions":["starter-criterion — replace with a real assertion from your test output"],"allowedOrigins":["collector-observed"]},{"id":"automated-review","definitionDigest":"2c5fa430cefef5014df7c0d93bcb7ca3712eea11b953f4ee949ad0266edffefe","assertions":["starter-criterion — replace with a real assertion from your test output"],"allowedOrigins":["collector-observed"]}]},"sourceRevision":"ccd936d7a3807c2622aae11455b659d1acc327621bfbf35bf1f2ce7a09656f96"},"timestamp":"2026-09-30T18:19:45.339Z","version":1,"type":"run-event","digest":"cf3ee47d6f885e44baa09449429a0e6225d16123c52c3403653fb94bb2d151be"},{"runId":"optional304-1790792362981","id":"d2c8a4d7-d0d9-4d80-bf5c-e25699a0cb93","previousDigest":"cf3ee47d6f885e44baa09449429a0e6225d16123c52c3403653fb94bb2d151be","generation":0,"kind":"candidate","payload":{"digest":"85991a4dd3a5c595b1ea55cd22690a5cf6efdd3bd57241f7886ec66a0fc3de45"},"timestamp":"2026-09-30T18:20:05.842Z","version":1,"type":"run-event","digest":"ec01b1134cac4d32f86245f62654d3a00a5ed1ddeaae99e76b876c1accd41ba9"},{"runId":"optional304-1790792362981","id":"881be7d4-9561-4e19-b9cc-815df5f23875","previousDigest":"ec01b1134cac4d32f86245f62654d3a00a5ed1ddeaae99e76b876c1accd41ba9","generation":0,"kind":"observation","payload":{"observation":{"id":"7d843ae0-00f3-4245-a0d4-66ccf3993160","invocationId":"7d843ae0-00f3-4245-a0d4-66ccf3993160","criterionId":"starter","producer":"agentflow:process-collector","origin":"collector-observed","isolation":"cooperative","candidateDigest":"85991a4dd3a5c595b1ea55cd22690a5cf6efdd3bd57241f7886ec66a0fc3de45","definitionDigest":"11629e1405b3f4c5fe2503a94aa9d941937026c4f973523f8e753d408fc29c74","executionContextDigest":"d86a490b8d80df887817a7655b22780d068306e3436eb21aa6a8a8f755b4df9e","executionContext":{"platform":"win32","architecture":"x64","collectorRuntime":"v26.10.0","executablePathDigest":"1703863d7f898e7ea52cce1201d4b8d31352eaa5beff10c963bb0af7a7d8543d","canonicalPathDigest":"1703863d7f898e7ea52cce1201d4b8d31352eaa5beff10c963bb0af7a7d8543d","executableContentDigest":"bc8441b811f5cefbe4e552b56ae0545f156e6917de2e4016d2755697addc5aeb","version":1,"type":"execution-context","digest":"d86a490b8d80df887817a7655b22780d068306e3436eb21aa6a8a8f755b4df9e"},"outcome":"pass","assertions":[{"id":"starter-criterion — replace with a real assertion from your test output","outcome":"pass"}],"startedAt":"2026-09-30T18:20:04.259Z","completedAt":"2026-09-30T18:20:04.598Z","errors":[],"exitCode":0,"signal":null,"timedOut":false,"spawnErrorCode":null,"stderrExcerpt":"npm notice run qualification304@1.0.0 test\nnpm notice run node check.cjs\n","version":1,"type":"verification-observation","digest":"fa62689f05606b8bb4bb4fe2b73704a9ee8008b0d45a7ef97b92aad0ff3ff407"}},"timestamp":"2026-09-30T18:20:23.668Z","version":1,"type":"run-event","digest":"331989adb1f30d5bf24fe9030b55aa44395ea33c4c05e721fe4b268286f4a91b"},{"runId":"optional304-1790792362981","id":"7a5718bf-174f-4ed3-ac3d-10c38e6887eb","previousDigest":"331989adb1f30d5bf24fe9030b55aa44395ea33c4c05e721fe4b268286f4a91b","generation":0,"kind":"observation","payload":{"observation":{"id":"937ef4ae-cb17-45b6-862e-b0acd04cf097","invocationId":"937ef4ae-cb17-45b6-862e-b0acd04cf097","criterionId":"automated-review","producer":"agentflow:process-collector","origin":"collector-observed","isolation":"cooperative","candidateDigest":"85991a4dd3a5c595b1ea55cd22690a5cf6efdd3bd57241f7886ec66a0fc3de45","definitionDigest":"2c5fa430cefef5014df7c0d93bcb7ca3712eea11b953f4ee949ad0266edffefe","executionContextDigest":"d86a490b8d80df887817a7655b22780d068306e3436eb21aa6a8a8f755b4df9e","executionContext":{"platform":"win32","architecture":"x64","collectorRuntime":"v26.10.0","executablePathDigest":"1703863d7f898e7ea52cce1201d4b8d31352eaa5beff10c963bb0af7a7d8543d","canonicalPathDigest":"1703863d7f898e7ea52cce1201d4b8d31352eaa5beff10c963bb0af7a7d8543d","executableContentDigest":"bc8441b811f5cefbe4e552b56ae0545f156e6917de2e4016d2755697addc5aeb","version":1,"type":"execution-context","digest":"d86a490b8d80df887817a7655b22780d068306e3436eb21aa6a8a8f755b4df9e"},"outcome":"pass","assertions":[{"id":"starter-criterion — replace with a real assertion from your test output","outcome":"pass"}],"startedAt":"2026-09-30T18:20:46.279Z","completedAt":"2026-09-30T18:20:46.725Z","errors":[],"exitCode":0,"signal":null,"timedOut":false,"spawnErrorCode":null,"stderrExcerpt":"npm notice run qualification304@1.0.0 test\nnpm notice run node check.cjs\n","version":1,"type":"verification-observation","digest":"f5f87e62e4ea6d6f30eda264cc68e8258016b3ee0621797e9f5eb61fd9ba86da"}},"timestamp":"2026-09-30T18:20:47.987Z","version":1,"type":"run-event","digest":"085e9235ce06f0ca38e68e764a07df006d99c9472488d1e11d6094eadb23df03"}]